{
  "archetype": "game-engine",
  "displayName": "Godot 4.7 卡拉尔世界引擎纯逻辑 (WebGames，非Web游戏)",
  "rootDirectory": "WebGames",
  "allowedExtensions": [".gd", ".py", ".json", ".sh", ".ps1", ".md"],
  "pathJail": {
    "allowedPrefixes": ["WebGames/"],
    "forbiddenPrefixes": ["workspace-timing/", "auto-refactor/", "scripts/"]
  },
  "associatedSkills": [
    "webgames-workflow",
    "spec-driven-development",
    "test-driven-development",
    "code-simplification",
    "debugging-and-error-recovery",
    "doubt-driven-development",
    "context-engineering",
    "constraint-driven-development",
    "complexity-budget",
    "test-benchmark-engineering"
  ],
  "rigidAxioms": [
    "【项目本质与技术栈红线】WebGames 为 Godot 4.7 引擎卡拉尔世界纯逻辑与配置驱动系统，绝对不是基于浏览器的 Web 游戏、网页游戏或 HTML5 游戏；严禁引入 Web/DOM/HTML/JS 前端技术栈，严禁依赖浏览器执行环境",
    "改动必须先立四阶段方案细则（严格仅 4 份文件），获批后方可编码",
    "全域数据统经 GameConfig.get_* 读取，严禁根目录平铺配置",
    "视图表现层零业务计算，数据一律经 apply_snapshot() 单向注入，Tabs 视图控制器必须保持显式强类型引用",
    "高承压对象池循环内零瞬态堆分配 (ADV-PRF-002)，必须实现 reset_state()",
    "单文件有效代码行严格受限 ELOC <= 900 / LOC <= 1400，杜绝单体巨文件与无约束膨胀",
    "测试套件零孤儿散落（tests/unit/ 根目录为 0），必须继承 TestCase 并按 domains/frontend/infrastructure 拓扑归位"
  ],
  "localVerification": [
    "python WebGames/scripts/py/audit_arch_static.py",
    "pwsh -File WebGames/scripts/ps1/check-gdscript.ps1",
    "pwsh -File WebGames/scripts/ps1/audit-all.ps1"
  ]
}
